{
  "$schema": "https://json-schema.org/draft/2020-12/schema",
  "$id": "https://raw.githubusercontent.com/erikpr1994/open-exercise-db/main/schema/exercise.schema.json",
  "title": "Exercise",
  "description": "One exercise. The file lives at exercises/<id>.json. Fields marked with x-vocab must hold a value from the named file in vocab/; the validation script enforces membership so vocabulary growth is a data change.",
  "type": "object",
  "additionalProperties": false,
  "required": [
    "id",
    "name",
    "modality",
    "level",
    "equipment",
    "primaryMuscles",
    "secondaryMuscles",
    "instructions",
    "images"
  ],
  "if": {
    "properties": { "measurementType": { "const": "breathing" } },
    "required": ["measurementType"]
  },
  "then": { "required": ["breathPattern"] },
  "else": { "not": { "required": ["breathPattern"] } },
  "properties": {
    "id": {
      "type": "string",
      "pattern": "^[a-z0-9]+(-[a-z0-9]+)*$",
      "description": "Slug. Also the file name and the folder name under images/."
    },
    "name": {
      "type": "string",
      "minLength": 1,
      "description": "Canonical English name. Must describe a concrete action, not a goal or a body region."
    },
    "aliases": {
      "type": "array",
      "description": "Alternative English names for the same movement, for search. The catalogue's base language is English; translation is a consumer concern.",
      "items": { "type": "string", "minLength": 1 },
      "uniqueItems": true
    },
    "family": {
      "description": "Slug of the family this exercise belongs to, or null when unclassified. Must resolve to a file in families/.",
      "anyOf": [
        { "type": "null" },
        { "type": "string", "pattern": "^[a-z0-9]+(-[a-z0-9]+)*$" }
      ]
    },
    "variantGroup": {
      "description": "Free-text presentation sub-group inside a large family, for example \"Incline\" or \"Kettlebell\".",
      "anyOf": [{ "type": "null" }, { "type": "string", "minLength": 1 }]
    },
    "modality": {
      "type": "string",
      "x-vocab": "modalities"
    },
    "level": {
      "type": "string",
      "x-vocab": "levels"
    },
    "mechanic": {
      "anyOf": [{ "type": "null" }, { "type": "string", "x-vocab": "mechanics" }]
    },
    "force": {
      "anyOf": [{ "type": "null" }, { "type": "string", "x-vocab": "forces" }]
    },
    "equipment": {
      "type": "string",
      "x-vocab": "equipment"
    },
    "primaryMuscles": {
      "type": "array",
      "items": { "type": "string", "x-vocab": "muscles" },
      "uniqueItems": true
    },
    "secondaryMuscles": {
      "type": "array",
      "items": { "type": "string", "x-vocab": "muscles" },
      "uniqueItems": true,
      "description": "Must not repeat a primary muscle."
    },
    "measurementType": {
      "description": "How a set of this exercise is measured. Intrinsic to the movement. Null means the exercise is a draft and not ready for workout use. Once set, curation policy treats it as immutable.",
      "anyOf": [
        { "type": "null" },
        { "type": "string", "x-vocab": "measurement-types" }
      ]
    },
    "laterality": {
      "description": "Whether the movement loads both sides at once (bilateral) or one side at a time (unilateral). A movement that alternates sides within a set is unilateral; a continuous locomotion or conditioning drill whose sides cycle within one effort (skips, sprints, climbers) is bilateral. Once set, it changes only through a correction entry in corrected-exercises.json.",
      "anyOf": [
        { "type": "null" },
        { "type": "string", "x-vocab": "lateralities" }
      ]
    },
    "directionality": {
      "description": "Whether the movement runs in one direction (unidirectional) or is performed in matching blocks in both directions, for example circles forward and then backward (bidirectional). Once set, it changes only through a correction entry in corrected-exercises.json.",
      "anyOf": [
        { "type": "null" },
        { "type": "string", "x-vocab": "directionalities" }
      ]
    },
    "breathPattern": {
      "type": "array",
      "minItems": 2,
      "description": "The steps of one round of a breathing exercise, in order, with the seconds of each step. Present only when measurementType is breathing.",
      "items": {
        "type": "object",
        "additionalProperties": false,
        "required": ["breath", "seconds"],
        "properties": {
          "breath": { "enum": ["in", "hold", "out"] },
          "seconds": { "type": "integer", "minimum": 1 }
        }
      }
    },
    "instructions": {
      "type": "array",
      "items": { "type": "string", "minLength": 1 },
      "description": "Ordered execution steps."
    },
    "images": {
      "type": "array",
      "items": {
        "type": "string",
        "pattern": "^[a-z0-9]+(-[a-z0-9]+)*/[0-9]+\\.(jpg|jpeg|png|webp)$"
      },
      "uniqueItems": true,
      "description": "Paths relative to images/. The folder must equal the exercise id, and every file must exist."
    },
    "video": {
      "description": "YouTube demo video, or null.",
      "anyOf": [
        { "type": "null" },
        {
          "type": "string",
          "pattern": "^https://((www\\.)?youtube\\.com/watch\\?v=|youtu\\.be/)[A-Za-z0-9_-]{11}$"
        }
      ]
    },
    "source": {
      "type": "object",
      "description": "Provenance of imported rows, kept for idempotent re-import and credit.",
      "additionalProperties": false,
      "required": ["name", "id"],
      "properties": {
        "name": { "type": "string", "minLength": 1 },
        "id": { "type": "string", "minLength": 1 }
      }
    }
  }
}
