{
  "id": "isometric-hamstring-bridge-hold",
  "name": "Isometric Hamstring Bridge Hold",
  "aliases": [
    "long-lever bridge hold"
  ],
  "family": "glute-bridge",
  "variantGroup": null,
  "modality": "strength",
  "level": "beginner",
  "mechanic": "isolation",
  "force": "static",
  "equipment": "body only",
  "primaryMuscles": [
    "hamstrings",
    "glutes"
  ],
  "secondaryMuscles": [
    "abdominals"
  ],
  "measurementType": "time",
  "laterality": "bilateral",
  "instructions": [
    "Lie on your back with your heels on the floor and your knees bent about 30 degrees. Place your feet further from your hips than for a normal bridge.",
    "Lift your hips until your body is in line from shoulders to knees. Keep your spine neutral.",
    "Push your heels into the floor and hold the position for the set time.",
    "Lower your hips slowly and rest."
  ],
  "images": [],
  "video": null
}
