{
  "id": "sled-push",
  "name": "Sled Push",
  "aliases": [
    "prowler push"
  ],
  "family": "sled-push-drag",
  "variantGroup": null,
  "modality": "strongman",
  "level": "beginner",
  "mechanic": "compound",
  "force": "push",
  "equipment": "sled",
  "primaryMuscles": [
    "quadriceps"
  ],
  "secondaryMuscles": [
    "calves",
    "chest",
    "glutes",
    "hamstrings",
    "triceps"
  ],
  "measurementType": "weighted_time",
  "laterality": "bilateral",
  "instructions": [
    "Load your pushing sled with the desired weight.",
    "Take an athletic posture, leaning into the sled with your arms fully extended, grasping the handles. Push the sled as fast as possible, focusing on extending your hips and knees to strengthen your posterior chain."
  ],
  "images": [
    "sled-push/0.jpg",
    "sled-push/1.jpg"
  ],
  "video": "https://www.youtube.com/watch?v=DrBawxjH3eU",
  "source": {
    "name": "free-exercise-db",
    "id": "Sled_Push"
  }
}
