{
  "id": "frankenstein-squat",
  "name": "Frankenstein Squat",
  "family": "squat",
  "variantGroup": "Barbell",
  "modality": "olympic weightlifting",
  "level": "intermediate",
  "mechanic": "compound",
  "force": "push",
  "equipment": "barbell",
  "primaryMuscles": [
    "quadriceps"
  ],
  "secondaryMuscles": [
    "abdominals",
    "calves",
    "glutes",
    "hamstrings"
  ],
  "measurementType": "weight_reps",
  "laterality": "bilateral",
  "instructions": [
    "This drill teaches you the proper positioning of both the bar and your body during the clean and front squat.",
    "Place the barbell on the front of the shoulders, releasing your grip and extending your arms out in front of you. The shoulders should be pushed forward to create a shelf, and the bar should be in contact with the throat. Ensure that you only move your shoulder blades forward; don't round the thoracic spine.",
    "Squat by flexing the knees and hips, sitting in between your legs. Keep the torso upright, the arms up, and the shoulders forward, and the bar should stay in place. Go to the bottom of the squat, until your hamstrings contact your calves.",
    "Return to the upright position by driving through the front of the heel and extending the knees and hips."
  ],
  "images": [
    "frankenstein-squat/0.jpg",
    "frankenstein-squat/1.jpg"
  ],
  "video": "https://www.youtube.com/watch?v=mtofpViNNtU",
  "source": {
    "name": "free-exercise-db",
    "id": "Frankenstein_Squat"
  }
}
