{
  "id": "isometric-wipers",
  "name": "Isometric Wipers",
  "family": "push-up",
  "variantGroup": null,
  "modality": "strength",
  "level": "beginner",
  "mechanic": "compound",
  "force": "push",
  "equipment": "body only",
  "primaryMuscles": [
    "chest"
  ],
  "secondaryMuscles": [
    "abdominals",
    "shoulders",
    "triceps"
  ],
  "measurementType": "time",
  "laterality": "bilateral",
  "instructions": [
    "Assume a push-up position, supporting your weight on your hands and toes while keeping your body straight. Your hands should be just outside of shoulder width. This will be your starting position.",
    "Begin by shifting your body weight as far to one side as possible, allowing the elbow on that side to flex as you lower your body.",
    "Reverse the motion by extending the flexed arm, pushing yourself up and then dropping to the other side.",
    "Repeat for the desired number of repetitions."
  ],
  "images": [
    "isometric-wipers/0.jpg",
    "isometric-wipers/1.jpg"
  ],
  "video": "https://www.youtube.com/watch?v=3MR2QWZU9Ao",
  "source": {
    "name": "free-exercise-db",
    "id": "Isometric_Wipers"
  }
}
