{
  "id": "floor-press",
  "name": "Floor Press",
  "aliases": [
    "Barbell Floor Press"
  ],
  "family": "floor-press",
  "variantGroup": null,
  "modality": "powerlifting",
  "level": "intermediate",
  "mechanic": "compound",
  "force": "push",
  "equipment": "barbell",
  "primaryMuscles": [
    "triceps"
  ],
  "secondaryMuscles": [
    "chest",
    "shoulders"
  ],
  "measurementType": "weight_reps",
  "laterality": "bilateral",
  "instructions": [
    "Adjust the j-hooks so they are at the appropriate height to rack the bar. Begin lying on the floor with your head near the end of a power rack. Keeping your shoulder blades pulled together; pull the bar off of the hooks.",
    "Lower the bar towards the bottom of your chest or upper stomach, squeezing the bar and attempting to pull it apart as you do so. Ensure that you tuck your elbows throughout the movement. Lower the bar until your upper arm contacts the ground and pause, preventing any slamming or bouncing of the weight.",
    "Press the bar back up as fast as you can, keeping the bar, your wrists, and elbows in line as you do so."
  ],
  "images": [
    "floor-press/0.jpg",
    "floor-press/1.jpg"
  ],
  "video": "https://www.youtube.com/watch?v=9llvBAV4RHI",
  "source": {
    "name": "free-exercise-db",
    "id": "Floor_Press"
  }
}
