{
  "id": "incline-push-up-wide",
  "name": "Incline Push-Up Wide",
  "aliases": [
    "wide grip incline pushup"
  ],
  "family": "push-up",
  "variantGroup": null,
  "modality": "strength",
  "level": "beginner",
  "mechanic": "compound",
  "force": "push",
  "equipment": "body only",
  "primaryMuscles": [
    "chest"
  ],
  "secondaryMuscles": [
    "abdominals",
    "shoulders",
    "triceps"
  ],
  "measurementType": "reps",
  "laterality": "bilateral",
  "instructions": [
    "Stand facing a Smith machine bar or sturdy elevated platform at an appropriate height.",
    "Place your hands on the bar, with your hands wider than shoulder width.",
    "Position your feet back from the bar with arms and body straight. Your arms should be perpendicular to the body. This will be your starting position.",
    "Keeping your body straight, lower your chest to the bar by bending the arms.",
    "Return to the starting position by extending the elbows, pressing yourself back up."
  ],
  "images": [
    "incline-push-up-wide/0.jpg",
    "incline-push-up-wide/1.jpg"
  ],
  "video": "https://www.youtube.com/watch?v=uYSmTpi32a4",
  "source": {
    "name": "free-exercise-db",
    "id": "Incline_Push-Up_Wide"
  }
}
