{
  "id": "adductor-groin",
  "name": "Adductor/Groin",
  "family": "adductor-groin-stretch",
  "variantGroup": null,
  "modality": "stretching",
  "level": "intermediate",
  "mechanic": null,
  "force": "static",
  "equipment": "body only",
  "primaryMuscles": [
    "adductors"
  ],
  "secondaryMuscles": [],
  "measurementType": "time",
  "laterality": "bilateral",
  "instructions": [
    "Lie on your back with your feet raised towards the ceiling.",
    "Have your partner hold your feet or ankles. Abduct your legs as far as you can. This will be your starting position.",
    "Attempt to squeeze your legs together for 10 or more seconds, while your partner prevents you from doing so.",
    "Now, relax the muscles in your legs as your partner pushes your feet apart, stretching as far as is comfortable for you. Be sure to let your partner know when the stretch is adequate to prevent overstretching or injury."
  ],
  "images": [
    "adductor-groin/0.jpg",
    "adductor-groin/1.jpg"
  ],
  "video": "https://www.youtube.com/watch?v=BXs0PIkdXGs",
  "source": {
    "name": "free-exercise-db",
    "id": "Adductor_Groin"
  }
}
