{
  "id": "quick-leap",
  "name": "Quick Leap",
  "family": "plyometric-jump",
  "variantGroup": null,
  "modality": "plyometrics",
  "level": "beginner",
  "mechanic": "compound",
  "force": "push",
  "equipment": "plyo box",
  "primaryMuscles": [
    "quadriceps"
  ],
  "secondaryMuscles": [
    "calves",
    "hamstrings"
  ],
  "measurementType": "reps",
  "laterality": "bilateral",
  "instructions": [
    "You will need a box for this exerise.",
    "Begin facing the box standing 1-2 feet from its edge.",
    "By utilizing your hips, hop onto the box, landing on both legs. Ensure that you land with your legs bent and your feet flat.",
    "Immediately upon landing, fully extend through the entire body and swing your arms overhead to explode off of the box. Use your legs to absorb the impact of landing."
  ],
  "images": [
    "quick-leap/0.jpg",
    "quick-leap/1.jpg"
  ],
  "video": "https://www.youtube.com/watch?v=dC4ygsR_lUU",
  "source": {
    "name": "free-exercise-db",
    "id": "Quick_Leap"
  }
}
