{
  "id": "log-lift",
  "name": "Log Lift",
  "aliases": [
    "log press",
    "log clean and press"
  ],
  "family": "strongman-load",
  "variantGroup": null,
  "modality": "strongman",
  "level": "intermediate",
  "mechanic": "compound",
  "force": "push",
  "equipment": "log",
  "primaryMuscles": [
    "shoulders"
  ],
  "secondaryMuscles": [
    "abdominals",
    "chest",
    "glutes",
    "hamstrings",
    "lower back",
    "middle back",
    "quadriceps",
    "traps",
    "triceps"
  ],
  "measurementType": "weight_reps",
  "laterality": "bilateral",
  "instructions": [
    "Begin standing with the log in front of you. Grasp the handles, and begin to clean the log. As you are bent over to start the clean, attempt to get the log as high as possible, pulling it into your chest. Extend through the hips and knees to bring it up to complete the clean.",
    "Push your head back and look up, creating a shelf on your chest to rest the log. Begin the press by dipping, flexing slightly through the knees and reversing the motion. This push press will generate momentum to start the log moving vertically. Continue by extending through the elbows to press the log above your head. There are no strict rules on form, so use whatever techniques you are most efficient with. As the log is pressed, ensure that you push your head through on each repetition, looking forward.",
    "Repeat as many times as possible. Attempt to control the descent of the log as it is returned to the ground."
  ],
  "images": [
    "log-lift/0.jpg",
    "log-lift/1.jpg"
  ],
  "video": "https://www.youtube.com/watch?v=aPIroCPPvcQ",
  "source": {
    "name": "free-exercise-db",
    "id": "Log_Lift"
  }
}
