{
  "id": "barbell-bench-press-medium-grip",
  "name": "Barbell Bench Press - Medium Grip",
  "aliases": [
    "bench press",
    "flat bench press"
  ],
  "family": "bench-press",
  "variantGroup": "Barbell Flat",
  "modality": "strength",
  "level": "beginner",
  "mechanic": "compound",
  "force": "push",
  "equipment": "barbell",
  "primaryMuscles": [
    "chest"
  ],
  "secondaryMuscles": [
    "shoulders",
    "triceps"
  ],
  "measurementType": "weight_reps",
  "laterality": "bilateral",
  "instructions": [
    "Lie back on a flat bench. Using a medium width grip (a grip that creates a 90-degree angle in the middle of the movement between the forearms and the upper arms), lift the bar from the rack and hold it straight over you with your arms locked. This will be your starting position.",
    "From the starting position, breathe in and begin coming down slowly until the bar touches your middle chest.",
    "After a brief pause, push the bar back to the starting position as you breathe out. Focus on pushing the bar using your chest muscles. Lock your arms and squeeze your chest in the contracted position at the top of the motion, hold for a second and then start coming down slowly again. Tip: Ideally, lowering the weight should take about twice as long as raising it.",
    "Repeat the movement for the prescribed amount of repetitions.",
    "When you are done, place the bar back in the rack."
  ],
  "images": [
    "barbell-bench-press-medium-grip/0.jpg",
    "barbell-bench-press-medium-grip/1.jpg"
  ],
  "video": "https://www.youtube.com/watch?v=6zWoAllRufg",
  "source": {
    "name": "free-exercise-db",
    "id": "Barbell_Bench_Press_-_Medium_Grip"
  }
}
