{
  "id": "isometric-chest-squeezes",
  "name": "Isometric Chest Squeezes",
  "family": null,
  "variantGroup": null,
  "modality": "strength",
  "level": "beginner",
  "mechanic": "compound",
  "force": "static",
  "equipment": "body only",
  "primaryMuscles": [
    "chest"
  ],
  "secondaryMuscles": [
    "shoulders",
    "triceps"
  ],
  "measurementType": "reps",
  "laterality": "bilateral",
  "instructions": [
    "While either seating or standing, bend your arms at a 90-degree angle and place the palms of your hands together in front of your chest. Tip: Your hands should be open with the palms together and fingers facing forward (perpendicular to your torso).",
    "Push both hands against each other as you contract your chest. Start with slow tension and increase slowly. Keep breathing normally as you execute this contraction.",
    "Hold for the recommended number of seconds.",
    "Now release the tension slowly.",
    "Rest for the recommended amount of time and repeat."
  ],
  "images": [
    "isometric-chest-squeezes/0.jpg",
    "isometric-chest-squeezes/1.jpg"
  ],
  "video": "https://www.youtube.com/watch?v=nHLI2INhwmY",
  "source": {
    "name": "free-exercise-db",
    "id": "Isometric_Chest_Squeezes"
  }
}
