{
  "id": "double-kettlebell-snatch",
  "name": "Double Kettlebell Snatch",
  "family": "snatch",
  "variantGroup": null,
  "modality": "strength",
  "level": "expert",
  "mechanic": "compound",
  "force": "pull",
  "equipment": "kettlebells",
  "primaryMuscles": [
    "shoulders"
  ],
  "secondaryMuscles": [
    "glutes",
    "hamstrings",
    "quadriceps"
  ],
  "measurementType": "weight_reps",
  "laterality": "bilateral",
  "instructions": [
    "Place two kettlebells behind your feet. Bend your knees and sit back to pick up the kettlebells.",
    "Swing the kettlebells between your legs forcefully and reverse the direction.",
    "Drive through with your hips and lock the ketttlebells overhead in one uninterrupted motion."
  ],
  "images": [
    "double-kettlebell-snatch/0.jpg",
    "double-kettlebell-snatch/1.jpg"
  ],
  "video": "https://www.youtube.com/watch?v=mkHnMSzDjVo",
  "source": {
    "name": "free-exercise-db",
    "id": "Double_Kettlebell_Snatch"
  }
}
