{
  "id": "bent-arm-barbell-pullover",
  "name": "Bent-Arm Barbell Pullover",
  "aliases": [
    "Barbell Pullover"
  ],
  "family": "pullover",
  "variantGroup": null,
  "modality": "strength",
  "level": "intermediate",
  "mechanic": "compound",
  "force": "pull",
  "equipment": "barbell",
  "primaryMuscles": [
    "lats"
  ],
  "secondaryMuscles": [
    "chest",
    "shoulders",
    "triceps"
  ],
  "measurementType": "weight_reps",
  "laterality": "bilateral",
  "instructions": [
    "Lie on a flat bench with a barbell using a shoulder grip width.",
    "Hold the bar straight over your chest with a bend in your arms. This will be your starting position.",
    "While keeping your arms in the bent arm position, lower the weight slowly in an arc behind your head while breathing in until you feel a stretch on the chest.",
    "At that point, bring the barbell back to the starting position using the arc through which the weight was lowered and exhale as you perform this movement.",
    "Hold the weight on the initial position for a second and repeat the motion for the prescribed number of repetitions."
  ],
  "images": [
    "bent-arm-barbell-pullover/0.jpg",
    "bent-arm-barbell-pullover/1.jpg"
  ],
  "video": "https://www.youtube.com/watch?v=3QiBnN2r51I",
  "source": {
    "name": "free-exercise-db",
    "id": "Bent-Arm_Barbell_Pullover"
  }
}
